{
  "type": "timeline",
  "version": "1.0.0",
  "id": "timeline-events-only",
  "metadata": { "title": "Events-only test" },
  "content": {
    "kind": "events",
    "events": [
      { "id": "e1", "label": "Event A", "date": "1900" },
      { "id": "e2", "label": "Event B", "date": "1910" }
    ]
  },
  "interaction": { "mode": "explore", "actions": ["select", "deselect", "focus", "reset"] },
  "questions": [],
  "sources": [{ "class": "illustrative" }],
  "accessibility": { "label": "Test events-only timeline" }
}